name,number,status
Asynchronous IO Support Rebooted: the “asyncio” Module,3156,SF
Python Web Server Gateway Interface v1.0.1,3333,IF
Python Language Governance Proposal Overview,8000,IF
Python Governance Voting Process,8001,PF
Open Source Governance Survey,8002,IF
The Technical Leader Governance Model,8010,IR
Python Governance Model Lead by Trio of Pythonistas,8011,IR
The Community Governance Model,8012,IR
The External Council Governance Model,8013,IR
The Commons Governance Model,8014,IR
Organization of the Python community,8015,IR
The Steering Council Model,8016,IA
January 2019 Steering Council election,8100,IF
2020 Term Steering Council election,8101,IF
2021 Term Steering Council election,8102,IF
2022 Term Steering Council election,8103,IF
2023 Term Steering Council election,8104,IA
